"       A szerződés megnevezése, típus,             tárgya ",  A szerződő fél megnevezése,      A szerződés             értéke,A szerződés időtartama        időtartama
Megállapodás pénzeszközátadásra Győri Vízisport Egyesület sporttevékenységének működésének támogatása,Győri Vízisport Egyesület nevében Ábrahám Csaba,"8.770.200,- Ft",2011. január 15-ig 
Megállapodás pénzeszközátadásra Gyirmóti Sport Egyesület sporttevékenységének működésének támogatása,Gyirmóti Sport Egyesület nevében  Horváth Ernő,"4.544.670,- Ft",2011. január 31-ig
Megállapodás pénzeszközátadásra Bercsényi DSE Győr sporttevékenységének működésének támogatása,Bercsényi DSE Győr nevében Kollár András ,"2.000.000,- Ft",2011. január 15-ig
Megállapodás pénzeszközátadásra ETO Futsal Club működési költségeinek támogatása,ETO Futsal Club nevében  Dr. Drucskó Zoltán,"30.149.200,- Ft",2011. január 15-ig
Megállapodás pénzeszközátadásra Széchenyi István Egyetem Sportegyesülete működésének támogatása,Széchenyi István Egyetem Sportegyesülete nevében  Farkas Péter,"428.000,- Ft",2011. január 15-ig
"Megállapodás pénzeszközátadásra Forrás Waldorf Iskola oktatásának, működésének támogatása",Forrás Waldorf Iskola nevében Dóbiás Tamás,"2.000.000,- Ft",2010. december 15-ig
Megállapodás pénzeszközátadásra Széchenyi István Egyetemen működő AUDI Hungária Belső Égésű Motorok Tanszék fejlesztésének támogatása,Széchenyi István Egyetem nevében Dr. Szekeres Tamás,"325.008.000,- Ft",2011. június 30-ig
