"A szerződés megnevezése, Típusa, tárgya",A szerződő fél megnevezése,A szerződés várható nettó értéke,A szerződés időtartama
"Együttműködési megállapodás Szállítói Hírcity.hu Internet-tv folyamatosan beszámolás darabokról, riportokat készít, stb.",Hírcity Kft,"1.320.000,-",2011.01.01-2011.12.31.
Szállítási szerződés Szállítói Hangtechnikai berendezések beszerzése ,Partner Elektronic Kft,"24.256.600,-",2011.02.01-2011.03.02.
Adás-Vételi szerződés Szállítói 1db Skoda Superb Comfort 2.0 ct tdi személygépkocsi beszerzése ,Porsche Inter Auto Hungária Kft /Porsche Győr telephely,"5.132.600,-",2011.02.01-2011.05.23.
"Bérleti szerződés Szállítói Terület bérlet, biztonsági szolgáltatás ",HÖRMANN Holding Kft,"760.662,-",2011.01.05-2011.07.31.
Megbízási szerződés Szállítói Fotózás,Kanyó Fotó Bt,"540.000,-",2011.01.24-2011.06.30.
Vállalkozási szerződés Szállítói Biztonsági szolgáltatás megbízási díj módosítás,Security Patent Kft,"11.049.516,-",2011.01.01-2011.12.31.
Bérleti megállapodás Szállítói 3db fénymásoló bérlet meghosszabbítás  24.500+Á/gép+ másolati díj,ECOFFICE KFT,"882.000,-+ másolati díj",2011.01.01-2011.12.31.
