"A szerződés megnevezése, típusa, tárgya",A szerződő fél megnevezése,A szerződés értéke,A szerződés időtartama
Vállalkozói szerződés Iskolai ablakcsere,Ablak Doktor Kft 9024-Győr Kálvária út 30.,"Nettó :4.004.024,- Áfa:       993.657,- Bruttó:5.961.944,-",2009. június 16- 2009. július 3.
Megbízási szerződés Ablakcsere műszaki ellenőri feladatok ellátása,Skerlanitz Zsolt 9172-Győrzámoly Dr. Pécsi Gy. út 24.,"Nettó:  31.167,- Áfa:       6.833-, Bruttó: 38.000,-",2009. június 16- 2009. július 3.
Vállalkozói szerződés Iskolai vizesblokk karbantartási munkálatai,"ÉPISZIG Kft 9028-Győr, Fehérvári út 75.","Nettó: 3.604.120,- Áfa:      720.824,- Bruttó:4.324.944,",2009. június 16- 2009. június 30.
Megbízási szerződés Iskolai vizesblokk karbantartás műszaki ellenőri feladatok ellátása,Skerlanitz Zsolt 9172-Győrzámoly Dr. Pécsi Gy. út 24.,"Nettó:  54.167,- Áfa:     10.833-, Bruttó: 65.000,-",2009. június 16- 2009. június 30.
"Vállalkozói szerződés Iskolai főelosztó szabványosítása, tűzvédelmi főkapcsoló kialakítása, kapcsolók cseréje","Kukorelli János 9024-Győr, Nagy Imre út 45.","Nettó: 780.000,- Áfa:    156.000,- Bruttó:936.000,-",2009. június 16- 2009. június 30.
Bérleti szerződés,"Nemzeti Utánpótlás-nevelési és Sportszolgáltató Intézet 1146-Budapest, Istvánmezei út 1-3.","Bruttó :140.000,-",2009. január 1- 2009. május 31.
