A támogatott neve,A támogatás célja,A támogatás összege  (Ft),A támogatott program megvalósítási helye
Győr-M-Sopron Megyei Önkormányzat Petz Aladár Megyei Oktató Kórház,Gép-műszer beszerzés támogatása,25.000.000.-,"Petz Aladár Megyei Oktató Kórház 9024 Győr, Vasvári P. u. 2-4."
Győr-M-Sopron Megyei Önkormányzat Petz Aladár Megyei Oktató Kórház- Szent Imre úti szakrendelő ,"Szent Imre úti szakrendelő felújítására, műszerezettségének javítására",10.000.000.-,"Szent Imre úti szakrendelő 9024 Győr, Szent Imre u. 41."
Mit tehetnék Érted? Autista Otthon Alapítvány ,Az Alapítvány működésének támogatása,1.500.000.-,"Autista Otthon Alapítvány 9098 Mindszentpuszta, Ady E. u. 3."
Szívkatéterezés Győr Alapítvány,Az Alapítvány működésének támogatása,5.000.000.-,"Szívkatéterezés Győr Alapítvány 9024 Győr, Vasvári P. u. 2-4."
"A szerződés megnevezése, típusa, tárgya",A szerződő fél megnevezése,A szerződés értéke,A szerződés időtartama
Tárgy: Termálfürdő bérletek                 vásárlása,"Rába Quelle Kft.  9025 Győr, Fürdőtér",26.400.000.- Ft,2009.02. 28-tól 2010.02. 28-ig
