"A szerződés megnevezése,típusa, tárgya",A szerződő fél megnevezése,A szerződés értéke,A szerződés időtartama
Megbízás Tárgy:  KEF titkári megbízás,Baconi-Oláh Dóra,       30   000/ hó,2008.10.15-től 2008.12.31-ig
Megbízás Tárgy:  Táncórák droghasználat szempontjából hátrányos helyzetű  gyerekeknek,El Paso Táncstúdió,Alkalmanként: 21 000  Ft. ( 2 x 45 perc),2008.10. 29-től 2008. 12.17-ig
"Megbízás Tárgy:„Nyitott Tornaterem”- program, felügyelő pedagógus",Aggné Magyar Csilla Módi Sándor,1 óra/ 4000 Ft.,2008. 11. 04-től 2008. 12. 19-ig
"Megbízás Tárgy: „Nyitott Tornaterem”- program, felügyelő pedagógus",Marton István,1 óra/ 4000 Ft.,2008. 12. 09-től 2008. 12. 20-ig
Megbízás Tárgy: Drogprevenciós program csoportvezetés,Kaliba Edit,27 000 Ft.,2008 12. 05-től 2008. 12.31-ig
Megbízás Tárgy: Drogprevenciós program vezetése,Czagányi Zsuzsanna,27 000 Ft.,2008. 12. 05-től 2008. 12. 31-ig
Megbízás Tárgy: Drogprevenciós program vezetése,Hécz Gabriella,27 000 Ft.,2008. 12. 05-től 2008. 12. 31-ig
