A támogatott neve,A támogatás célja,A támogatás összege (eFt),A támogatott program megvalósítási helye
Xantus János Állatkert Kht,Belépőjegyek előállítása,"250,azaz kettőszázötvenezer Ft",Győr
Rába Sárkányhajó Club,II.Sárkányhajó Fesztivál szervezési költségei,"150,azaz százötvenezer Ft",Győr
Győri Borbarát Hölgyek Egyesülete,Borfesztivál reklámtevékenysége,"250,azaz kettőszázötvenezer Ft",Győr
Xantus János Állatkert Kht,Szlovák-magyar szórólapok készítése,"250,azaz kettőszázötvenezer Ft",Győr
Vendégvárók Egyesülete,Chéf 2005 szervezési költségei,"250,azaz kettőszázötvenezer Ft",Győr
