"A szerződés megnevezése, típusa, tárgya",A szerződő fél megnevezése,A szerződés értéke Forgalom nettó,A szerződés időtartama
Megrendelés Tárgy: 8 bölcsőde részére konyhai eszközök.,"EMA-LION Bonyhádi Zománcáru Kft 7150 Bonyhád, Perczel M. u. 84.","882.618,-",2016.10.07.-2016.10.31.
Megrendelés Tárgy: Kodály Z. u. bölcsődék részére villamos felülvizsgálat.,"SZI-PE VILL Kft 9024 Győr, Kovács M. u. 1.","733.200,- Ft",2016.10.12.-2016.12.15.
Megrendelés Tárgy: Cuha u. bölcsőde részére öltöző szekrények. ,"Dénes Ferenc e.v. 9082 Nyúl, Tavasz út 42.","166.567,- Ft ",2016.10.11.-2016.11.30.
Megrendelés Tárgy: Mónus I. u. bölcsőde részére bútorok. ,"Dénes Ferenc e.v. 9082 Nyúl, Tavasz út 42.","195.584,- Ft",2016.10.11.-2016.11.30.
Megrendelés Tárgy: Örkény I. u. bölcsőde részére játékok.,"REGIO Játékkereskedelmi Kft 1119 Budapest, Nándorfejérvári út 23-25.","114.902,- Ft",2016.10.26.-2016.11.04.
